# The following kindergartens exists in the https://nbr.udir.no/enhet/{id} directory, but gives 404 at http://barnehagefakta.no/api/barnehage/{id}, the following kindergartens are probably discontinued.
"name", "operator", "nbr id"
"Todalen og Stangvik Oppvekstsenter Avd Stangvik Barnehage", "Surnadal kommune", "1018206"
"Todalen og Stangvik Oppvekstsenter Avd Todalen Barnehage", "Surnadal kommune", "1018208"
"Øye og Skei barnehage Avd. Skei", "Surnadal kommune", "1017373"
"Øye og Skei barnehage Avd. Øye", "Surnadal kommune", "1013290"
