# The following kindergartens exists in the https://nbr.udir.no/enhet/{id} directory, but gives 404 at http://barnehagefakta.no/api/barnehage/{id}, the following kindergartens are probably discontinued.
"name", "operator", "nbr id"
"Kløverenga Pedagogiske Veiledningstjenester", "Kløverenga Pedagogiske Veiledningstjenester Berit Ingrid Nygård", "1020494"
"Lille Krabat Familiebarnehage Avd Skedsmo", "Lille Krabat Aina Lie", "1020548"
"Lille Krabat Familiebarnehage Avd Skjetten", "Lille Krabat Aina Lie", "1020549"
"Noahs Ark barnehage AS", "Noahs Ark barnehage AS", "2000241"
"Theta-Koden Powell Wang", "Theta-Koden Powell Wang", "1021004"
