# The following kindergartens exists in the https://nbr.udir.no/enhet/{id} directory, but gives 404 at http://barnehagefakta.no/api/barnehage/{id}, the following kindergartens are probably discontinued.
"name", "operator", "nbr id"
"Astral Anett Powell Østmo", "Astral Anett Powell Østmo", "1021004"
"Framtia barnehage", "Lørenskog kommune", "2000085"
"Hundremeterskogen Familiebarnehage Nasse Nøff", "Hundremeterskogen Familiebarnehage avd Nasse Nøff Marianne O Knardahl", "1020355"
"Luna Familiebarnehage Avdeling Skårer", "Luna Familiebarnehage V/helle Slott Hitchinson", "2000100"
"Xtra Hjelpen Eva", "Xtra Hjelpen E. Sitje", "1021014"
